{
  "mappingId": "EMAS-MAP-PRESALES",
  "mappingVersion": "1.0.0",
  "phaseCode": "PRE_SALES",
  "phaseName": "Pre-Sales Assessment",
  "description": "Technical report-binding contract for the Pre-Sales Assessment controlled template. Defines exactly where the shared PowerShell reporting engine writes normalized result-object fields. Contains no business rules, RAG logic, classification logic or effort logic; those remain governed exclusively by the Runtime JSON Contract, Normalized Rule Model and Runtime JSON Schema.",
  "template": {
    "templateId": "EMAS-TPL-PRESALES",
    "templateName": "eMAS_PreSales_Template.xlsx",
    "templateVersion": "1.1.1",
    "templateFilePath": "templates/controlled/pre-sales/eMAS_PreSales_Template.xlsx",
    "templateControlTable": "tblPreSalesTemplateControl"
  },
  "requiredSheetOrder": [
    "01_Executive_Summary",
    "02_Scope_&_Effort",
    "03_Dossier_Inventory",
    "04_Sequence_Inventory",
    "05_Findings_&_Clarifications",
    "06_Path_&_Volume",
    "07_Assumptions_&_Method",
    "08_Execution_Details"
  ],
  "protectedTables": [
    {
      "sheetName": "08_Execution_Details",
      "tableName": "tblPreSalesTemplateControl",
      "protection": "readOnly",
      "preserveHeadersExactly": false,
      "reason": "Release-managed template identity/version/status metadata (TemplateId, TemplateVersion, PhaseCode, Status, ChangeSummary, RequiredSheetNames, RequiredTableNames). Set only at controlled template release, never written by the reporting engine at execution time. The engine may read TemplateVersion/RequiredTableNames from this table for compatibility verification only."
    }
  ],
  "tableMappings": [
    {
      "sheetName": "01_Executive_Summary",
      "tableName": "tblPreSalesSummary",
      "sourceCollection": "summaryMetrics",
      "writeMode": "matchRowByLabelColumns",
      "labelColumns": ["Area", "Metric"],
      "allowAppendAdditionalRows": false,
      "rowCapacity": {
        "maxPreProvisionedRows": 30,
        "rowInsertionBehavior": "appendWithinPreProvisionedRange",
        "followingTable": null
      },
      "headerRow": 6,
      "firstDataRow": 7,
      "notes": "30 pre-authored metric rows (Report Context, Scope and Volume, Classification, Structure and Quality, Estimate). The engine locates each row by its existing Area+Metric text and fills only the Value/EvaluationStatus/RAG/Confidence/ValueSource/ReviewRequired columns; it must not add, remove or reorder metric rows.",
      "columns": [
        { "targetColumn": "Area", "sourceField": "area", "required": true, "dataType": "String", "controlledValueList": null, "format": null, "isLabelColumn": true },
        { "targetColumn": "Metric", "sourceField": "metric", "required": true, "dataType": "String", "controlledValueList": null, "format": null, "isLabelColumn": true },
        { "targetColumn": "Value", "sourceField": "value", "required": true, "dataType": "String", "controlledValueList": null, "format": null },
        { "targetColumn": "EvaluationStatus", "sourceField": "evaluationStatus", "required": true, "dataType": "Code", "controlledValueList": "EvaluationStatus", "format": null },
        { "targetColumn": "RAG", "sourceField": "rag", "required": false, "dataType": "Code", "controlledValueList": "RAG", "format": null },
        { "targetColumn": "Confidence", "sourceField": "confidence", "required": false, "dataType": "Code", "controlledValueList": "Confidence", "format": null },
        { "targetColumn": "ValueSource", "sourceField": "valueSource", "required": true, "dataType": "Code", "controlledValueList": "ValueSource", "format": null },
        { "targetColumn": "ReviewRequired", "sourceField": "reviewRequired", "required": false, "dataType": "Code", "controlledValueList": "YesNo", "format": null },
        { "targetColumn": "Description", "sourceField": null, "required": false, "dataType": "LongText", "controlledValueList": null, "format": null, "notes": "Pre-authored template guidance text; never written by the engine." }
      ]
    },
    {
      "sheetName": "02_Scope_&_Effort",
      "tableName": "tblPreSalesEffortDrivers",
      "sourceCollection": "effortDrivers",
      "writeMode": "appendRows",
      "rowCapacity": {
        "maxPreProvisionedRows": 5,
        "rowInsertionBehavior": "insertAndShiftFollowingTable",
        "followingTable": "tblPreSalesRecommendations"
      },
      "headerRow": 6,
      "firstDataRow": 7,
      "notes": "Shares its sheet with tblPreSalesRecommendations, whose header sits 5 rows below this table's first data row. A driver set larger than 5 rows requires the engine to insert rows here and shift tblPreSalesRecommendations (and its data) down by the same count before appending further driver rows.",
      "columns": [
        { "targetColumn": "DriverId", "sourceField": "driverId", "required": true, "dataType": "Identifier", "controlledValueList": null, "format": null },
        { "targetColumn": "DriverCode", "sourceField": "driverCode", "required": true, "dataType": "Identifier", "controlledValueList": null, "format": null },
        { "targetColumn": "DriverName", "sourceField": "driverName", "required": true, "dataType": "String", "controlledValueList": null, "format": null },
        { "targetColumn": "DriverCategory", "sourceField": "driverCategory", "required": false, "dataType": "String", "controlledValueList": null, "format": null },
        { "targetColumn": "MetricCode", "sourceField": "metricCode", "required": false, "dataType": "Identifier", "controlledValueList": null, "format": null },
        { "targetColumn": "ObservedValue", "sourceField": "observedValue", "required": false, "dataType": "String", "controlledValueList": null, "format": null },
        { "targetColumn": "Unit", "sourceField": "unit", "required": false, "dataType": "Code", "controlledValueList": "Unit", "format": null },
        { "targetColumn": "ValueSource", "sourceField": "valueSource", "required": true, "dataType": "Code", "controlledValueList": "ValueSource", "format": null },
        { "targetColumn": "EvaluationStatus", "sourceField": "evaluationStatus", "required": true, "dataType": "Code", "controlledValueList": "EvaluationStatus", "format": null },
        { "targetColumn": "RAG", "sourceField": "rag", "required": false, "dataType": "Code", "controlledValueList": "RAG", "format": null },
        { "targetColumn": "Severity", "sourceField": "severity", "required": false, "dataType": "Code", "controlledValueList": "Severity", "format": null },
        { "targetColumn": "EffortImpact", "sourceField": "effortImpact", "required": false, "dataType": "Code", "controlledValueList": "EffortConfidenceImpact", "format": null, "notes": "Qualitative-only dropdown (Increases Band / Neutral / Decreases Band); raw numeric weights must never be written here." },
        { "targetColumn": "ConfidenceImpact", "sourceField": "confidenceImpact", "required": false, "dataType": "Code", "controlledValueList": "EffortConfidenceImpact", "format": null, "notes": "Same qualitative-only dropdown as EffortImpact." },
        { "targetColumn": "MinimumBandOverride", "sourceField": "minimumBandOverride", "required": false, "dataType": "Code", "controlledValueList": "YesNo", "format": null },
        { "targetColumn": "EvidenceSummary", "sourceField": "evidenceSummary", "required": false, "dataType": "LongText", "controlledValueList": null, "format": null },
        { "targetColumn": "RuleId", "sourceField": "ruleId", "required": false, "dataType": "Identifier", "controlledValueList": null, "format": null },
        { "targetColumn": "FindingCode", "sourceField": "findingCode", "required": false, "dataType": "Identifier", "controlledValueList": null, "format": null },
        { "targetColumn": "CustomerFacingExplanation", "sourceField": "customerFacingExplanation", "required": false, "dataType": "LongText", "controlledValueList": null, "format": null },
        { "targetColumn": "RecommendationCode", "sourceField": "recommendationCode", "required": false, "dataType": "Identifier", "controlledValueList": null, "format": null },
        { "targetColumn": "RecommendedAction", "sourceField": "recommendedAction", "required": false, "dataType": "LongText", "controlledValueList": null, "format": null },
        { "targetColumn": "Comments", "sourceField": "comments", "required": false, "dataType": "LongText", "controlledValueList": null, "format": null }
      ]
    },
    {
      "sheetName": "02_Scope_&_Effort",
      "tableName": "tblPreSalesRecommendations",
      "sourceCollection": "recommendations",
      "writeMode": "appendRows",
      "rowCapacity": {
        "maxPreProvisionedRows": 1000,
        "rowInsertionBehavior": "appendWithinPreProvisionedRange",
        "followingTable": null
      },
      "headerRow": 12,
      "firstDataRow": 13,
      "notes": "Additional source collection beyond the phase's required baseline list; needed because tblPreSalesRecommendations exists in the finalized template and requires a source. Last table on its sheet; no shift required.",
      "columns": [
        { "targetColumn": "RecommendationId", "sourceField": "recommendationId", "required": true, "dataType": "Identifier", "controlledValueList": null, "format": null },
        { "targetColumn": "RecommendationCode", "sourceField": "recommendationCode", "required": true, "dataType": "Identifier", "controlledValueList": null, "format": null },
        { "targetColumn": "Area", "sourceField": "area", "required": false, "dataType": "String", "controlledValueList": null, "format": null },
        { "targetColumn": "CustomerFacingRecommendation", "sourceField": "customerFacingRecommendation", "required": true, "dataType": "LongText", "controlledValueList": null, "format": null },
        { "targetColumn": "ConsultantFacingNote", "sourceField": "consultantFacingNote", "required": false, "dataType": "LongText", "controlledValueList": null, "format": null },